{
  "id": "demo-factuur-mailer",
  "name": "Factuur-mailer (demo)",
  "version": "0.4.0",
  "description": "Demo, verzonnen. Stuurt wekelijks openstaande facturen rond. Staat nu op fout.",
  "runtime": "Node",
  "status": "error",
  "schedule": "0 9 * * 1",
  "connections": [
    { "name": "boekhouding", "type": "http" },
    { "name": "smtp", "type": "other" },
    { "name": "orchestrator", "type": "webhook" }
  ],
  "output": "facturen.json",
  "size": { "lines": 720, "files": 6 },
  "demo": true
}
